{
    "$schema": "http://json-schema.org/draft-07/schema#",
    "type": "object",
    "properties": {
      "consentGiver": { "type": "string" },
      "retentionPeriodDays": { "type": "number" },
      "dataCreationDate": { "type": "string", "format": "date" },
      "retentionDates": { "type": "string", "format": "date" },
      "consentedOrganisations": {
        "type": "array",
        "items": { "type": "string" },
        "minItems": 1
      },
      "dataController": { "type": "string" },
      "foreignKeyProcess": { "type": "number" },
      "consentMethod": { "type": "string" },
      "lawfulBasis": { "type": "string" },
      "permittedProcessing": {
        "type": "array",
        "items": { "type": "string" },
        "minItems": 1
      },
      "dataConsentStatus": { "type": "string" },
      "consentDate": { "type": "string", "format": "date" },
      "consentVersionRef": { "type": "string" },
      "typeProcessingPermitted": {
        "type": "array",
        "items": { "type": "string" },
        "minItems": 1
      },
      "consentReviewDate": { "type": "string", "format": "date" },
      "dataZoneClassification": { "type": "string" },
      "datasetOwner": { "type": "string" },
      "processType": { "type": "string" },
      "processPurpose": { "type": "string" },
      "participatingOrganisations": {
        "type": "array",
        "items": { "type": "string" },
        "minItems": 1
      },
      "dataProcessingConducted": {
        "type": "array",
        "items": { "type": "string" },
        "minItems": 1
      },
      "foreignKeyConsent": { "type": "number" },
      "precedentProcesses": { "type": "array", "items": {} },
      "dependentProcesses": { "type": "array", "items": {} },
      "outputDataList": { "type": "array", "items": {} }
    },
    "required": [
      "consentGiver",
      "retentionPeriodDays",
      "dataCreationDate",
      "retentionDates",
      "consentedOrganisations",
      "dataController",
      "foreignKeyProcess",
      "consentMethod",
      "lawfulBasis",
      "permittedProcessing",
      "dataConsentStatus",
      "consentDate",
      "consentVersionRef",
      "typeProcessingPermitted",
      "consentReviewDate",
      "dataZoneClassification",
      "datasetOwner",
      "processType",
      "processPurpose",
      "participatingOrganisations",
      "dataProcessingConducted",
      "foreignKeyConsent"
    ]
  }