{
    "consentGiver": "Steer, Steven",
    "retentionPeriodDays": 90,
    "dataCreationDate":"23-03-2020",
    "retentionDates": "23-03-2024",
    "consentedOrganisations": ["UKPN", "NGESO","Octopus"],
    "dataController": "Steer, Steven",
    "foreignKeyProcess": 4328934,
    "consentMethod": "Online",
    "lawfulBasis": "Consent",
    "permittedProcessing": ["Marketing","Performance"],
    "dataConsentStatus": "Withdrawn",
    "consentDate": "23-03-2023",
    "consentVersionRef": "2",
    "typeProcessingPermitted": ["Analytics","Reporting","Marketing"],
    "consentReviewDate":"23-03-2023",
    "dataZoneClassification": "Unclassified",
    "datasetOwner": "Steer, Steven",
    "processType": "Analytics",
    "processPurpose": "Analytics",
    "participatingOrganisations": ["Octopus","EON","EDF"],
    "dataProcessingConducted": ["type1","type2"],
    "foreignKeyConsent":1234324,
    "precedentProcesses": [],
    "dependentProcesses": [],
    "outputDataList": []


}